{
  "schema_version": "1.0.1",
  "fiscal_number": "FN300000001",
  "artifact_class": "DOCUMENT",
  "aggregate_type": "DOCUMENT",
  "aggregate_id": "rcpt-001",
  "sequence_no": 1,
  "idempotency_key": "hub:fn300000001:rcpt-001:v1",
  "created_at": "2026-03-28T10:16:00Z",
  "payload": {
    "document_id": "rcpt-001",
    "state": "ACK"
  }
}
